id,filtered_words,features,label_indexed
F058,"[two, debate, present, garden., walk, fire, whether, treatment., —, shocking, claims, government, cover-up, surface, internet.]","(262144,[3665,35623,38426,56627,76162,91799,132517,137448,153652,198400,242727,245086,245522,249598,258728],[0.6871770135734415,0.691153161953081,0.691153161953081,2.8844015909096608,0.691153161953081,4.607168188650764,2.997730276216664,4.830311739964974,3.914021008090819,0.691153161953081,5.523458920524919,4.270695952029551,4.137164559405029,4.607168188650764,4.607168188650764])",0.0
R164,"[window, generation., natural, church, stage, become., summer, play, offer, whole, enough., experts, discuss, ongoing, developments, education.]","(262144,[18386,25491,67662,72462,79207,80707,118617,123981,167401,177466,186757,192742,196975,199991,223518,256508],[4.607168188650764,4.137164559405029,4.137164559405029,0.6871770135734415,4.607168188650764,4.137164559405029,3.914021008090819,4.137164559405029,4.270695952029551,0.691153161953081,5.523458920524919,0.6832166123573445,0.691153161953081,2.6330871626287546,4.019381523748645,4.270695952029551])",1.0
F242,"[best, upon, figure., challenge, since, leg, information., smile, agree, wife, ball., —, shocking, claims, celebrity, scandal, surface, internet.]","(262144,[3665,25838,31839,35623,38426,76162,87427,120594,157865,166027,181561,198400,201517,222903,227501,233967,235691,258431],[0.6871770135734415,2.849310271098391,3.914021008090819,0.691153161953081,0.691153161953081,0.691153161953081,4.830311739964974,3.7316994512968646,4.019381523748645,4.830311739964974,2.849310271098391,0.691153161953081,4.137164559405029,4.830311739964974,4.270695952029551,4.270695952029551,4.607168188650764,4.137164559405029])",0.0
F064,"[cost, wish, expert, marriage, government., probably, training, skill, local., —, shocking, claims, mind, control, surface, internet.]","(262144,[3665,20719,35623,38426,46498,63949,76162,146794,148921,165688,170688,171040,198400,209326,236565,247026],[0.6871770135734415,3.914021008090819,0.691153161953081,0.691153161953081,4.019381523748645,4.830311739964974,0.691153161953081,4.42484663185681,3.914021008090819,2.8154087194227095,2.920769235080536,4.607168188650764,0.691153161953081,5.117993812416755,4.270695952029551,3.6516567436233283])",0.0
R228,"[break, indicate, particular, boy, lead., degree, quite, probably., pressure, weight, newspaper, weight, start., family, father, number, leg, piece., experts, discuss, ongoing, developments, education.]","(262144,[14967,16487,68404,69949,70152,72462,87885,120594,124348,129941,133192,135239,146984,171368,177466,192202,192742,196975,199991,208838,218721,221017],[5.523458920524919,4.42484663185681,8.84969326371362,4.137164559405029,4.137164559405029,0.6871770135734415,4.019381523748645,3.7316994512968646,4.270695952029551,4.42484663185681,4.137164559405029,4.019381523748645,4.607168188650764,3.914021008090819,0.691153161953081,4.607168188650764,0.6832166123573445,0.691153161953081,2.6330871626287546,3.5085558999826545,4.830311739964974,4.270695952029551])",1.0
R210,"[sing, word, weight, daughter., already, however, often, loss, expert, lay, trial, care., experience, ask, lose., experts, discuss, ongoing, developments, economic, growth.]","(262144,[2162,2306,2622,24031,47065,52471,55875,64145,67288,68404,72462,90058,90723,108340,117155,138667,142239,177466,192742,196975,247026],[4.137164559405029,4.270695952029551,4.607168188650764,4.270695952029551,5.523458920524919,4.137164559405029,4.019381523748645,4.137164559405029,2.7200985396183848,4.42484663185681,0.6871770135734415,2.920769235080536,4.137164559405029,4.830311739964974,4.607168188650764,4.137164559405029,4.42484663185681,0.691153161953081,0.6832166123573445,0.691153161953081,3.6516567436233283])",1.0
R156,"[enter, former, full, expect, military, there., experts, discuss, ongoing, developments, policy.]","(262144,[62400,63045,72462,86971,122832,133243,151393,177466,192742,196975,200876],[4.137164559405029,3.914021008090819,0.6871770135734415,4.42484663185681,2.8154087194227095,3.8187108282864943,4.607168188650764,0.691153161953081,0.6832166123573445,0.691153161953081,5.523458920524919])",1.0
R192,"[authority, appear, season, pm, attack., attack, threat, small, radio, security., candidate, speech, large, suggest, apply, play, reach, deal., experts, discuss, ongoing, developments, climate, change.]","(262144,[13784,33358,35501,46806,55270,72462,73499,76150,102360,107502,123981,139106,177466,185509,192742,196975,200560,214210,219622,220270,221310,226582,226839,234955],[4.137164559405029,4.270695952029551,4.019381523748645,3.914021008090819,4.270695952029551,0.6871770135734415,2.7508701982851385,4.137164559405029,4.270695952029551,4.42484663185681,4.137164559405029,4.137164559405029,0.691153161953081,2.849310271098391,0.6832166123573445,0.691153161953081,4.019381523748645,4.019381523748645,4.42484663185681,4.270695952029551,4.830311739964974,4.019381523748645,5.523458920524919,4.830311739964974])",1.0
F102,"[ahead, bit, remember, material, describe, continue., —, shocking, claims, government, cover-up, surface, internet.]","(262144,[3665,35623,38426,56627,63420,76162,126783,132517,137765,138845,166253,196997,198400],[0.6871770135734415,0.691153161953081,0.691153161953081,2.8844015909096608,4.270695952029551,0.691153161953081,4.137164559405029,2.997730276216664,4.270695952029551,4.270695952029551,5.117993812416755,4.42484663185681,0.691153161953081])",0.0
R237,"[imagine, last, phone, sit., politics, life, fly, drug, quality, card., experts, discuss, ongoing, developments, election.]","(262144,[5381,6122,22373,39928,41348,43890,72462,172517,174396,177466,192742,196975,205460,238314,249855],[4.270695952029551,4.270695952029551,4.019381523748645,4.019381523748645,2.7508701982851385,4.270695952029551,0.6871770135734415,4.270695952029551,5.117993812416755,0.691153161953081,0.6832166123573445,0.691153161953081,2.849310271098391,4.830311739964974,4.830311739964974])",1.0
F015,"[world, action, ground, message, actually., operation, heavy, avoid, pick, century., —, shocking, claims, immortal, jellyfish, surface, internet.]","(262144,[1797,3665,35623,38426,52306,60080,76162,84796,104220,133367,158795,166372,198400,220194,225056,247236,257017],[4.270695952029551,0.6871770135734415,0.691153161953081,0.691153161953081,2.7508701982851385,3.6516567436233283,0.691153161953081,4.42484663185681,3.8187108282864943,4.137164559405029,3.8187108282864943,2.7508701982851385,0.691153161953081,4.019381523748645,5.523458920524919,5.117993812416755,3.6516567436233283])",0.0
F020,"[boy, language, idea, important., control, nearly, hear, suffer, decision., —, shocking, claims, celebrity, scandal, surface, internet.]","(262144,[3665,6034,25838,35623,38426,69949,76162,76633,111370,116836,116961,127702,155607,165688,181561,198400],[0.6871770135734415,4.019381523748645,2.849310271098391,0.691153161953081,0.691153161953081,4.137164559405029,0.691153161953081,5.523458920524919,4.42484663185681,4.019381523748645,5.117993812416755,4.830311739964974,3.8187108282864943,2.8154087194227095,2.849310271098391,0.691153161953081])",0.0
R083,"[goal, view, speech, score., may, particular, even, money., middle, benefit, far, consumer, pick, star., experts, discuss, ongoing, developments, election.]","(262144,[10617,21894,41348,46806,63713,68657,72462,88813,91192,104220,130203,133192,165678,174966,177466,192742,196975,199411,208549],[4.42484663185681,3.7316994512968646,2.7508701982851385,3.914021008090819,5.117993812416755,4.137164559405029,0.6871770135734415,4.42484663185681,4.137164559405029,3.8187108282864943,4.607168188650764,4.137164559405029,3.914021008090819,4.270695952029551,0.691153161953081,0.6832166123573445,0.691153161953081,4.830311739964974,3.7316994512968646])",1.0
F035,"[grow, majority, white, citizen, trial., everybody, leg, later, main, music., sit, toward, congress, nothing., —, shocking, claims, hoax, surface, internet.]","(262144,[3665,9781,35623,38426,56194,75571,76162,101641,117274,120594,124629,127691,141144,186264,193920,198400,227256,250556,253860,260465],[0.6871770135734415,4.019381523748645,0.691153161953081,0.691153161953081,3.914021008090819,4.270695952029551,0.691153161953081,2.60568818844064,4.42484663185681,3.7316994512968646,5.117993812416755,4.607168188650764,4.830311739964974,4.270695952029551,4.607168188650764,0.691153161953081,4.019381523748645,4.137164559405029,4.607168188650764,4.270695952029551])",0.0
R082,"[wait, hope, next, business, learn., experts, discuss, ongoing, developments, budget, report.]","(262144,[27643,30600,54961,72462,116782,128160,150069,177466,192742,195055,196975],[4.830311739964974,2.661258039595451,4.019381523748645,0.6871770135734415,3.8187108282864943,4.42484663185681,3.8187108282864943,0.691153161953081,0.6832166123573445,2.5530444549552183,0.691153161953081])",1.0
F114,"[watch, church, stage, poor, become., page, parent, along, fight, college, population., late, population, tell, require, truth, court., —, shocking, claims, mind, control, surface, internet.]","(262144,[3665,18386,21996,35623,38426,59514,68727,76162,85530,85735,110427,118617,146542,165688,166936,170688,198135,198400,209969,219097,223518,229604,238949,260401],[0.6871770135734415,4.607168188650764,4.830311739964974,0.691153161953081,0.691153161953081,3.914021008090819,4.42484663185681,0.691153161953081,5.523458920524919,4.137164559405029,4.019381523748645,3.914021008090819,4.830311739964974,2.8154087194227095,4.270695952029551,2.920769235080536,5.523458920524919,0.691153161953081,4.42484663185681,4.270695952029551,4.019381523748645,4.137164559405029,4.830311739964974,4.607168188650764])",0.0
F179,"[someone, election, fact, country, kitchen, movie, painting., population, budget, throw, series, sing, throughout., quality, night, capital, rest, century., —, shocking, claims, secret, cure, surface, internet.]","(262144,[3665,3924,19263,35623,38078,38426,39954,43890,48885,59514,76162,92891,117155,148039,163886,167503,189957,190212,195055,198400,210223,217316,221709,247236,250372],[0.6871770135734415,4.607168188650764,4.42484663185681,0.691153161953081,5.117993812416755,0.691153161953081,5.117993812416755,4.270695952029551,4.270695952029551,3.914021008090819,0.691153161953081,2.5530444549552183,4.607168188650764,4.607168188650764,4.607168188650764,4.607168188650764,4.270695952029551,4.270695952029551,2.5530444549552183,0.691153161953081,3.8187108282864943,4.137164559405029,4.270695952029551,5.117993812416755,2.5530444549552183])",0.0
F026,"[talk, congress, page, ability, particular., national, suffer, month, message, stock, indeed., voice, able, bar, rather, next, tend, report., unit, others, authority, training, agree, bar, instead, thought., —, shocking, claims, celebrity, scandal, surface, internet.]","(262144,[3665,13784,18697,25838,30600,35623,38426,43583,46498,52351,54961,72125,75181,76162,86769,89628,101464,102234,110427,111892,155607,158661,158795,181561,197209,198400,212790,221058,227256,227501,236924,259901],[0.6871770135734415,4.137164559405029,4.607168188650764,2.849310271098391,2.661258039595451,0.691153161953081,0.691153161953081,3.577548771469606,4.019381523748645,4.019381523748645,4.019381523748645,4.42484663185681,4.137164559405029,0.691153161953081,4.270695952029551,4.830311739964974,4.137164559405029,4.270695952029551,4.019381523748645,8.541391904059102,3.8187108282864943,4.607168188650764,3.8187108282864943,2.849310271098391,4.830311739964974,0.691153161953081,4.019381523748645,4.607168188650764,4.019381523748645,4.270695952029551,4.42484663185681,4.42484663185681])",0.0
R217,"[sense, often, onto., foot, activity, win, measure, effect, maybe., month, thought, cost., experts, discuss, ongoing, developments, election.]","(262144,[15875,31924,41348,47183,52471,72462,75181,77886,93819,142343,148528,170530,177466,192742,196975,201511,253518],[5.117993812416755,4.830311739964974,2.7508701982851385,5.523458920524919,4.137164559405029,0.6871770135734415,4.137164559405029,5.117993812416755,5.523458920524919,3.914021008090819,4.42484663185681,4.607168188650764,0.691153161953081,0.6832166123573445,0.691153161953081,4.137164559405029,4.019381523748645])",1.0
F009,"[argue, use, back, letter, various, action, learn., indeed, good, society, term, together, allow., develop, cut, education, realize, nothing., lose, evidence, modern, ground, view., —, shocking, claims, celebrity, scandal, surface, internet.]","(262144,[3665,4254,20326,25838,27643,35623,38426,49217,76162,98717,102006,113432,115124,124629,125177,132270,133367,143990,147224,160983,161106,181561,194710,196620,198132,198400,212368,246711,251610,257017],[0.6871770135734415,3.914021008090819,4.270695952029551,2.849310271098391,4.830311739964974,0.691153161953081,0.691153161953081,4.607168188650764,0.691153161953081,4.137164559405029,4.270695952029551,4.830311739964974,4.607168188650764,5.117993812416755,4.42484663185681,4.607168188650764,4.137164559405029,4.42484663185681,4.019381523748645,4.019381523748645,4.137164559405029,2.849310271098391,5.117993812416755,4.42484663185681,4.270695952029551,0.691153161953081,4.270695952029551,4.270695952029551,4.42484663185681,3.6516567436233283])",0.0
F240,"[set, story, music, apply, film, share, decade., newspaper, list, always, value, line., —, shocking, claims, aliens, surface, internet.]","(262144,[3665,14376,17291,35623,38426,64181,64859,68627,76162,79779,111767,123499,131250,178266,198400,200560,208838,209518],[0.6871770135734415,4.019381523748645,4.42484663185681,0.691153161953081,0.691153161953081,4.830311739964974,4.019381523748645,5.117993812416755,0.691153161953081,3.8187108282864943,4.42484663185681,4.607168188650764,4.42484663185681,2.958509563063383,0.691153161953081,4.019381523748645,3.5085558999826545,4.270695952029551])",0.0
R216,"[total, attack, us, reduce, quite., structure, organization, future, trade, strong, tonight., keep, market, hospital, minute, return, three., experts, discuss, ongoing, developments, research.]","(262144,[8145,32890,35501,72462,78766,89462,93722,109156,111168,111229,120418,140532,166319,172196,176551,177466,179731,192742,196975,220547,252968,261675],[4.830311739964974,4.270695952029551,4.019381523748645,0.6871770135734415,5.523458920524919,4.830311739964974,2.8844015909096608,4.137164559405029,4.42484663185681,4.607168188650764,4.42484663185681,4.270695952029551,4.019381523748645,4.42484663185681,4.42484663185681,0.691153161953081,4.830311739964974,0.6832166123573445,0.691153161953081,4.137164559405029,4.019381523748645,4.137164559405029])",1.0
F129,"[staff, science, imagine, admit, nice, big, campaign., program, according, lot, common., —, shocking, claims, flat, earth, surface, internet.]","(262144,[3665,19392,22346,22373,33180,35623,37542,38426,72720,76162,76285,95840,115996,161194,172888,190787,198400,245599],[0.6871770135734415,5.523458920524919,3.7316994512968646,4.019381523748645,4.607168188650764,0.691153161953081,3.0385522707369192,0.691153161953081,5.523458920524919,0.691153161953081,4.270695952029551,4.607168188650764,3.0385522707369192,4.137164559405029,4.42484663185681,4.137164559405029,0.691153161953081,4.137164559405029])",0.0
R197,"[health, eat, side, various, hit., summer, ten, create, trouble, baby, realize, less, election., experts, discuss, ongoing, developments, education.]","(262144,[2325,3564,4254,41348,62245,64317,72462,105627,117829,153917,160983,167401,176996,177466,192742,196975,199991,202572],[4.137164559405029,4.830311739964974,3.914021008090819,2.7508701982851385,4.607168188650764,4.42484663185681,0.6871770135734415,4.42484663185681,4.830311739964974,4.607168188650764,4.019381523748645,4.270695952029551,3.577548771469606,0.691153161953081,0.6832166123573445,0.691153161953081,2.6330871626287546,4.019381523748645])",1.0
F142,"[home, especially, fish, program, enjoy., wrong, military, watch, page, alone, join., force, despite, identify, cell, sure, blue, voice, hospital., family, manager, develop, strong., —, shocking, claims, government, cover-up, surface, internet.]","(262144,[3665,8694,17893,27308,35623,38426,39526,56103,56627,62532,63045,76162,76285,78170,94101,102234,103048,110427,125177,132517,134125,152255,187359,189056,198400,201440,221017,224909,229604,237834],[0.6871770135734415,4.830311739964974,4.270695952029551,4.019381523748645,0.691153161953081,0.691153161953081,4.607168188650764,4.270695952029551,2.8844015909096608,4.830311739964974,3.914021008090819,0.691153161953081,4.270695952029551,5.117993812416755,4.830311739964974,4.270695952029551,4.270695952029551,4.019381523748645,4.42484663185681,2.997730276216664,3.914021008090819,5.117993812416755,4.137164559405029,3.914021008090819,0.691153161953081,4.019381523748645,4.270695952029551,4.137164559405029,4.137164559405029,4.42484663185681])",0.0
R140,"[thank, area, though, save, choice., economic, author, direction, model, mrs, light, never., threat, set, else, remain, citizen., experts, discuss, ongoing, developments, climate, change.]","(262144,[63109,67288,67562,72462,73499,81783,109208,116859,137415,145697,167466,177466,185509,192742,196975,199496,208158,209518,219622,234233,243088,248630,250942],[4.137164559405029,2.7200985396183848,4.137164559405029,0.6871770135734415,2.7508701982851385,3.8187108282864943,4.42484663185681,4.607168188650764,4.137164559405029,4.019381523748645,4.830311739964974,0.691153161953081,2.849310271098391,0.6832166123573445,0.691153161953081,4.607168188650764,4.019381523748645,4.270695952029551,4.42484663185681,4.270695952029551,5.523458920524919,4.270695952029551,5.117993812416755])",1.0
R165,"[relate, single, happy, item, page, project, maintain., open, resource, fill, enter, process, worker., experts, discuss, ongoing, developments, budget, report.]","(262144,[14636,15755,30600,50886,72462,73199,78833,86971,110427,149910,169527,177466,181499,183411,192742,195055,196975,245420,248200],[4.270695952029551,4.830311739964974,2.661258039595451,4.019381523748645,0.6871770135734415,3.914021008090819,4.270695952029551,4.42484663185681,4.019381523748645,3.914021008090819,4.019381523748645,0.691153161953081,4.830311739964974,4.830311739964974,0.6832166123573445,2.5530444549552183,0.691153161953081,4.137164559405029,3.7316994512968646])",1.0
R139,"[even, everything, first, ability, pay, over., baby, personal, human, cause, turn, most., score, strategy, pass, song, reflect., experts, discuss, ongoing, developments, education.]","(262144,[17734,72462,77772,86769,88302,105242,115587,123940,134303,142931,174966,176996,177466,179671,184280,188835,189418,192742,196975,199991,239713,246751],[4.607168188650764,0.6871770135734415,3.914021008090819,4.270695952029551,4.607168188650764,5.117993812416755,3.8187108282864943,4.137164559405029,4.42484663185681,4.137164559405029,4.270695952029551,3.577548771469606,0.691153161953081,4.270695952029551,4.607168188650764,4.607168188650764,4.607168188650764,0.6832166123573445,0.691153161953081,2.6330871626287546,3.914021008090819,4.42484663185681])",1.0
F232,"[high, practice, style, message., —, shocking, claims, hoax, surface, internet.]","(262144,[3665,35623,38426,76162,85119,101641,134304,136020,198400,204984],[0.6871770135734415,0.691153161953081,0.691153161953081,0.691153161953081,4.830311739964974,2.60568818844064,4.270695952029551,4.830311739964974,0.691153161953081,4.42484663185681])",0.0
F108,"[poor, drug, smile, dream, happen., culture, establish, travel, law, impact, add., note, sit, cup, occur, contain, debate, republican., —, shocking, claims, celebrity, scandal, surface, internet.]","(262144,[3665,10251,15313,25337,25838,35623,38426,43157,56194,76162,82597,85735,87595,153652,154659,157865,175115,175752,179812,181561,185422,198400,205460,208190,232869],[0.6871770135734415,4.607168188650764,4.137164559405029,3.577548771469606,2.849310271098391,0.691153161953081,0.691153161953081,4.019381523748645,3.914021008090819,0.691153161953081,4.137164559405029,4.137164559405029,3.8187108282864943,3.914021008090819,4.270695952029551,4.019381523748645,5.523458920524919,5.117993812416755,4.607168188650764,2.849310271098391,4.830311739964974,0.691153161953081,2.849310271098391,4.607168188650764,4.019381523748645])",0.0
F167,"[service, reality, personal, without, summer., power, street, base, that., field, spring, individual, half, enough, audience., —, shocking, claims, celebrity, scandal, surface, internet.]","(262144,[3665,17252,25838,35623,38426,38668,43167,43756,51576,70292,76162,78896,113004,115587,157270,181561,183339,189996,192450,195421,197113,198400],[0.6871770135734415,4.019381523748645,2.849310271098391,0.691153161953081,0.691153161953081,5.117993812416755,4.830311739964974,4.137164559405029,4.607168188650764,3.7316994512968646,0.691153161953081,3.8187108282864943,4.019381523748645,3.8187108282864943,3.8187108282864943,2.849310271098391,4.137164559405029,4.270695952029551,4.270695952029551,4.019381523748645,4.42484663185681,0.691153161953081])",0.0
R242,"[brother, security, section., politics, man, technology., example, design, see, girl, responsibility, after., former, already, state, ask., experts, discuss, ongoing, developments, research.]","(262144,[2306,8538,13781,14221,62400,72462,75750,92032,93722,109753,160334,177466,192742,194186,196975,202290,203617,204877,244119,249411,249855],[4.270695952029551,4.270695952029551,4.137164559405029,5.117993812416755,4.137164559405029,0.6871770135734415,4.137164559405029,4.607168188650764,2.8844015909096608,4.42484663185681,4.270695952029551,0.691153161953081,0.6832166123573445,4.270695952029551,0.691153161953081,4.019381523748645,5.117993812416755,4.270695952029551,5.117993812416755,4.270695952029551,4.830311739964974])",1.0
F133,"[thought, cause, stuff, standard, enjoy, work., case, stock, time, system, increase, fall, thank., including, marriage, boy, need, onto., national, understand, cultural, him., —, shocking, claims, immortal, jellyfish, surface, internet.]","(262144,[2701,3665,15875,18697,35623,37521,38426,47819,52306,69949,76162,77772,81210,83161,84007,121517,142343,160860,166372,173751,184774,192310,198400,212790,222718,222808,225159,235665,236565],[4.607168188650764,0.6871770135734415,5.117993812416755,4.607168188650764,0.691153161953081,4.42484663185681,0.691153161953081,3.914021008090819,2.7508701982851385,4.137164559405029,0.691153161953081,3.914021008090819,3.8187108282864943,4.019381523748645,4.830311739964974,4.137164559405029,3.914021008090819,4.019381523748645,2.7508701982851385,5.523458920524919,4.137164559405029,4.42484663185681,0.691153161953081,4.019381523748645,5.523458920524919,5.523458920524919,4.270695952029551,4.137164559405029,4.270695952029551])",0.0
F025,"[thank, thought, writer, music., finally, hard, congress., ability, return, close, evidence, painting, around., —, shocking, claims, flat, earth, surface, internet.]","(262144,[2437,3665,7625,17361,20326,35623,37542,38426,57226,76162,81783,86769,115996,127691,142343,163449,179514,193281,198400,261675],[4.137164559405029,0.6871770135734415,4.270695952029551,4.830311739964974,4.270695952029551,0.691153161953081,3.0385522707369192,0.691153161953081,4.42484663185681,0.691153161953081,3.8187108282864943,4.270695952029551,3.0385522707369192,4.607168188650764,3.914021008090819,3.914021008090819,4.607168188650764,5.523458920524919,0.691153161953081,4.137164559405029])",0.0
F093,"[easy, day, question, argue., begin, experience, place, executive, leg., —, shocking, claims, immortal, jellyfish, surface, internet.]","(262144,[3665,35623,38426,52306,55875,70998,76162,84566,96984,119214,166372,198400,204931,236373,254061,257017],[0.6871770135734415,0.691153161953081,0.691153161953081,2.7508701982851385,4.019381523748645,4.270695952029551,0.691153161953081,4.830311739964974,4.42484663185681,4.270695952029551,2.7508701982851385,0.691153161953081,4.42484663185681,5.523458920524919,5.117993812416755,3.6516567436233283])",0.0
F236,"[point, quite, half, question, appear, family., kitchen, power, eye, poor., food, green, drug, series, government, cell., —, shocking, claims, government, cover-up, surface, internet.]","(262144,[3665,17252,19263,35623,38426,56627,70152,76150,76162,78896,121133,131685,132517,148880,159799,170513,190212,198400,204931,205460,216869,231213],[0.6871770135734415,4.019381523748645,4.42484663185681,0.691153161953081,0.691153161953081,5.7688031818193215,4.137164559405029,4.137164559405029,0.691153161953081,3.8187108282864943,4.42484663185681,4.830311739964974,2.997730276216664,4.270695952029551,4.830311739964974,5.523458920524919,4.270695952029551,0.691153161953081,4.42484663185681,2.849310271098391,5.117993812416755,4.137164559405029])",0.0
F069,"[production, avoid, court., pretty, debate, plant, away, hour, pattern., read, beyond, modern, share, player., —, shocking, claims, flat, earth, surface, internet.]","(262144,[3665,9129,23071,32817,35623,37542,38426,53570,64859,76162,84796,98431,115996,153652,172822,194775,198400,212368,221812,260401,260940],[0.6871770135734415,4.137164559405029,4.137164559405029,4.019381523748645,0.691153161953081,3.0385522707369192,0.691153161953081,4.019381523748645,4.019381523748645,0.691153161953081,4.42484663185681,3.914021008090819,3.0385522707369192,3.914021008090819,5.523458920524919,5.523458920524919,0.691153161953081,4.270695952029551,3.6516567436233283,4.607168188650764,4.019381523748645])",0.0
