id,filtered_words,features,label_indexed
R235,"[couple, woman, power, suffer, page., black, approach, model, visit, lawyer, another., try, memory, whatever, want, time, fact., experts, discuss, ongoing, developments, technology, breakthrough.]","(262144,[10077,46309,56956,58392,72462,78896,85085,92726,121517,135923,154828,155607,172731,177466,183375,190256,192742,195459,196975,201479,206426,208158,213605],[4.270695952029551,4.830311739964974,2.579019941358479,5.117993812416755,0.6871770135734415,3.8187108282864943,3.6516567436233283,4.607168188650764,4.137164559405029,4.42484663185681,4.137164559405029,3.8187108282864943,5.523458920524919,0.691153161953081,3.914021008090819,4.607168188650764,0.6832166123573445,2.7200985396183848,0.691153161953081,4.137164559405029,4.019381523748645,4.019381523748645,4.019381523748645])",1.0
R163,"[son, medical, role, position., apply, land, table, section, chance., experts, discuss, ongoing, developments, climate, change.]","(262144,[43339,72462,73499,93484,97416,105729,108726,114395,177466,185509,192742,196975,200560,209084,221128],[4.830311739964974,0.6871770135734415,2.7508701982851385,4.830311739964974,5.117993812416755,4.137164559405029,4.019381523748645,4.137164559405029,0.691153161953081,2.849310271098391,0.6832166123573445,0.691153161953081,4.019381523748645,4.607168188650764,4.270695952029551])",1.0
R002,"[tv, fast, animal, audience, reason., seat, significant, attorney, leave., experts, discuss, ongoing, developments, education.]","(262144,[17128,25615,27139,31097,72165,72462,113503,177466,192742,196975,199991,212560,222895,223600],[4.607168188650764,4.137164559405029,5.117993812416755,5.523458920524919,4.019381523748645,0.6871770135734415,4.137164559405029,0.691153161953081,0.6832166123573445,0.691153161953081,2.6330871626287546,4.137164559405029,5.117993812416755,4.137164559405029])",1.0
R021,"[oil, low, audience., range, campaign, campaign, raise, car, sound., sense, hour, modern., experts, discuss, ongoing, developments, education.]","(262144,[71578,72462,73171,87623,98431,159733,177466,192742,196975,197113,199991,201511,226147,235803,244425,257982],[4.019381523748645,0.6871770135734415,4.270695952029551,4.42484663185681,3.914021008090819,4.607168188650764,0.691153161953081,0.6832166123573445,0.691153161953081,4.42484663185681,2.6330871626287546,4.137164559405029,9.660623479929948,4.137164559405029,4.830311739964974,4.830311739964974])",1.0
R013,"[customer, skill, economic, education., service, western, this., experts, discuss, ongoing, developments, technology, breakthrough.]","(262144,[17132,43756,56163,56956,67288,72462,142373,171040,177466,192742,195459,196975,199991],[3.914021008090819,4.137164559405029,4.830311739964974,2.579019941358479,2.7200985396183848,0.6871770135734415,4.42484663185681,4.607168188650764,0.691153161953081,0.6832166123573445,2.7200985396183848,0.691153161953081,2.6330871626287546])",1.0
F195,"[go, base, defense, person, lead, nice, ready., option, line, north., —, shocking, claims, flat, earth, surface, internet.]","(262144,[3665,22346,35623,37542,38426,76162,100919,110078,115996,128077,148675,152049,185228,194874,195421,198400,209090],[0.6871770135734415,3.7316994512968646,0.691153161953081,3.0385522707369192,0.691153161953081,0.691153161953081,3.914021008090819,4.42484663185681,3.0385522707369192,3.914021008090819,4.137164559405029,3.914021008090819,3.8187108282864943,4.607168188650764,4.019381523748645,0.691153161953081,5.117993812416755])",0.0
R101,"[subject, stand, one, wife, work, less., environment, hotel, eye, international, management., experts, discuss, ongoing, developments, research.]","(262144,[12231,21823,26092,34343,35975,36319,49574,72462,91031,93722,177466,192742,196975,201517,231213,232951],[5.523458920524919,4.42484663185681,4.137164559405029,4.42484663185681,5.523458920524919,4.270695952029551,4.270695952029551,0.6871770135734415,3.914021008090819,2.8844015909096608,0.691153161953081,0.6832166123573445,0.691153161953081,4.137164559405029,4.137164559405029,3.8187108282864943])",1.0
R055,"[ahead, defense, small, hit., social, stand, increase, degree, vote, beat., experts, discuss, ongoing, developments, research.]","(262144,[16487,33358,47819,49574,49918,63420,71895,72462,93722,100919,117829,175564,177466,192742,196975],[4.42484663185681,4.270695952029551,3.914021008090819,4.270695952029551,4.607168188650764,4.270695952029551,4.42484663185681,0.6871770135734415,2.8844015909096608,3.914021008090819,4.830311739964974,5.117993812416755,0.691153161953081,0.6832166123573445,0.691153161953081])",1.0
F190,"[loss, final, describe, must, provide, election., system, class, trouble, beyond, store., power, anything, guess, street, meeting, street, traditional., —, shocking, claims, secret, cure, surface, internet.]","(262144,[3665,35623,38426,41348,52388,64145,64317,70292,76162,78820,78896,92891,107810,138845,160860,189716,198400,221812,229407,235415,245973,250372,260874,261603],[0.6871770135734415,0.691153161953081,0.691153161953081,2.7508701982851385,5.523458920524919,4.137164559405029,4.42484663185681,7.463398902593729,0.691153161953081,4.607168188650764,3.8187108282864943,2.5530444549552183,4.270695952029551,4.270695952029551,4.019381523748645,3.914021008090819,0.691153161953081,3.6516567436233283,3.8187108282864943,4.607168188650764,4.830311739964974,2.5530444549552183,4.137164559405029,5.117993812416755])",0.0
R004,"[key, sister, surface, reflect, likely, safe, international, safe., seek, space, community, debate, hot., feel, feeling, leg, relate., experts, discuss, ongoing, developments, education.]","(262144,[3665,11018,16293,26092,34366,45252,55307,61657,61899,72462,75249,120594,137733,140466,153652,162155,177466,189755,192742,196975,199991,208632],[0.6871770135734415,4.42484663185681,4.137164559405029,4.137164559405029,4.42484663185681,3.914021008090819,4.019381523748645,4.607168188650764,4.019381523748645,0.6871770135734415,4.607168188650764,3.7316994512968646,4.019381523748645,4.830311739964974,3.914021008090819,4.019381523748645,0.691153161953081,5.117993812416755,0.6832166123573445,0.691153161953081,2.6330871626287546,5.117993812416755])",1.0
F080,"[increase, part, fund, rule., positive, condition, candidate, attack, teacher., nice, political, history., —, shocking, claims, celebrity, scandal, surface, internet.]","(262144,[3665,8804,22346,25838,35501,35623,38426,47819,76162,84640,104624,108815,162801,162863,181561,198400,208220,226582,258654],[0.6871770135734415,4.270695952029551,3.7316994512968646,2.849310271098391,4.019381523748645,0.691153161953081,0.691153161953081,3.914021008090819,0.691153161953081,3.8187108282864943,5.523458920524919,5.117993812416755,4.830311739964974,4.270695952029551,2.849310271098391,0.691153161953081,5.523458920524919,4.019381523748645,4.42484663185681])",0.0
F049,"[agree, natural, past, finish, decision, government., purpose, process, ability, staff, arrive, term, business, strong., throw, condition, less, accept, however., —, shocking, claims, hoax, surface, internet.]","(262144,[3665,35623,38426,39526,48885,61757,69650,76162,84640,86769,95840,100097,101641,105627,116782,119569,194681,196620,198400,209326,216975,227501,248200,250555,256508],[0.6871770135734415,0.691153161953081,0.691153161953081,4.607168188650764,4.270695952029551,5.117993812416755,3.914021008090819,0.691153161953081,3.8187108282864943,4.270695952029551,4.607168188650764,4.270695952029551,2.60568818844064,4.42484663185681,3.8187108282864943,4.607168188650764,4.270695952029551,4.42484663185681,0.691153161953081,5.117993812416755,4.137164559405029,4.270695952029551,3.7316994512968646,4.607168188650764,4.270695952029551])",0.0
F184,"[listen, whose, mother, yet, drop, third., new, visit, dark, area., word, benefit, community., —, shocking, claims, secret, cure, surface, internet.]","(262144,[3665,14385,24031,35623,38426,76162,89833,92891,128317,158421,198400,198985,206426,208549,211015,218239,223827,229305,245426,250372],[0.6871770135734415,4.830311739964974,4.270695952029551,0.691153161953081,0.691153161953081,0.691153161953081,3.8187108282864943,2.5530444549552183,4.137164559405029,4.270695952029551,0.691153161953081,5.117993812416755,4.019381523748645,3.7316994512968646,5.523458920524919,5.117993812416755,4.019381523748645,4.42484663185681,3.914021008090819,2.5530444549552183])",0.0
F030,"[style, far, challenge, perform, democrat., generation, since, act, doctor., prepare, main, stop, lead., —, shocking, claims, secret, cure, surface, internet.]","(262144,[3665,9781,31839,35623,38426,76162,92891,96285,104516,133406,134304,141306,165678,192202,198400,202268,218192,233967,250372,257347],[0.6871770135734415,4.019381523748645,3.914021008090819,0.691153161953081,0.691153161953081,0.691153161953081,2.5530444549552183,4.830311739964974,4.830311739964974,4.270695952029551,4.270695952029551,4.270695952029551,3.914021008090819,4.607168188650764,0.691153161953081,4.830311739964974,4.019381523748645,4.270695952029551,2.5530444549552183,4.137164559405029])",0.0
R213,"[resource, stay, research, inside, administration, beyond, way., five, teach, follow, sell, city, wind, church, expert., project, camera, type., experts, discuss, ongoing, developments, budget, report.]","(262144,[12710,13014,15775,30600,38698,39498,50886,54001,72462,73249,84738,118617,119246,123445,143572,143720,149910,177466,192742,195055,196975,213767,221812,229543],[4.42484663185681,5.523458920524919,5.523458920524919,2.661258039595451,4.137164559405029,3.8187108282864943,4.019381523748645,4.270695952029551,0.6871770135734415,4.270695952029551,4.42484663185681,3.914021008090819,4.830311739964974,3.914021008090819,4.830311739964974,4.137164559405029,3.914021008090819,0.691153161953081,0.6832166123573445,2.5530444549552183,0.691153161953081,4.42484663185681,3.6516567436233283,4.42484663185681])",1.0
F128,"[morning, bed, thought., much, bit, tend, region., several, western, level, toward, message, value., —, shocking, claims, immortal, jellyfish, surface, internet.]","(262144,[3665,17132,21641,35623,38426,50197,52306,75018,76162,76764,117274,131672,137765,139371,158795,166372,198400,221058,229979,259901],[0.6871770135734415,3.914021008090819,4.607168188650764,0.691153161953081,0.691153161953081,4.607168188650764,2.7508701982851385,5.117993812416755,0.691153161953081,4.137164559405029,4.42484663185681,4.137164559405029,4.270695952029551,3.6516567436233283,3.8187108282864943,2.7508701982851385,0.691153161953081,4.607168188650764,4.137164559405029,4.42484663185681])",0.0
R231,"[need, travel, mouth, everybody, either., account, back, control, behind., study, role, she., experts, discuss, ongoing, developments, policy.]","(262144,[25337,25363,39733,51487,72176,72462,83161,87257,108726,122832,132270,155648,165688,177466,192742,196975,260465],[3.577548771469606,4.607168188650764,5.117993812416755,4.830311739964974,4.137164559405029,0.6871770135734415,4.019381523748645,4.137164559405029,4.019381523748645,2.8154087194227095,4.607168188650764,5.523458920524919,2.8154087194227095,0.691153161953081,0.6832166123573445,0.691153161953081,4.270695952029551])",1.0
R061,"[must, organization, similar, heart, well., director, floor, mr, director., upon, enjoy, hit, seven, approach, bring., experts, discuss, ongoing, developments, technology, breakthrough.]","(262144,[2701,5537,11846,13981,29526,38202,56956,72462,97543,112352,114972,123343,140532,177466,183000,192742,195459,196975,201479,229407,258431],[4.607168188650764,5.117993812416755,5.523458920524919,4.137164559405029,4.42484663185681,4.019381523748645,2.579019941358479,0.6871770135734415,4.607168188650764,4.42484663185681,4.42484663185681,4.137164559405029,4.270695952029551,0.691153161953081,5.523458920524919,0.6832166123573445,2.7200985396183848,0.691153161953081,4.137164559405029,3.8187108282864943,4.137164559405029])",1.0
R137,"[fear, amount, suggest, large, our., tough, something, soon, way, prove., half, lot, large., experts, discuss, ongoing, developments, education.]","(262144,[4214,17252,51471,57058,57729,72462,102360,143057,177466,192742,196975,199991,202921,205687,220270,236097,245599,257829],[4.42484663185681,4.019381523748645,4.830311739964974,4.830311739964974,5.117993812416755,0.6871770135734415,4.270695952029551,4.019381523748645,0.691153161953081,0.6832166123573445,0.691153161953081,2.6330871626287546,4.607168188650764,4.137164559405029,4.270695952029551,5.117993812416755,4.137164559405029,5.523458920524919])",1.0
R185,"[laugh, receive, town., individual, together, week, wrong, behind, visit., experts, discuss, ongoing, developments, technology, breakthrough.]","(262144,[56956,68538,72462,97914,118659,147224,157270,163510,177466,192742,195459,196946,196975,201440,253913],[2.579019941358479,4.019381523748645,0.6871770135734415,3.8187108282864943,5.523458920524919,4.019381523748645,3.8187108282864943,5.523458920524919,0.691153161953081,0.6832166123573445,2.7200985396183848,4.42484663185681,0.691153161953081,4.019381523748645,3.914021008090819])",1.0
R204,"[water, window, remember, agree., represent, phone, appear, act, player, student., experts, discuss, ongoing, developments, technology, breakthrough.]","(262144,[6122,25491,56956,67117,72462,76150,100445,173289,177466,192742,195459,196975,196997,210331,218192,233148],[4.270695952029551,4.137164559405029,2.579019941358479,4.137164559405029,0.6871770135734415,4.137164559405029,5.523458920524919,5.117993812416755,0.691153161953081,0.6832166123573445,2.7200985396183848,0.691153161953081,4.42484663185681,4.830311739964974,4.019381523748645,4.42484663185681])",1.0
F217,"[purpose, five, music, back., attorney, economy, american, vote., eat, company, meet, course., —, shocking, claims, immortal, jellyfish, surface, internet.]","(262144,[3665,12710,35623,38426,52306,72165,76162,112478,125689,127310,131250,138836,149982,153524,166372,194681,198400,202572,217827],[0.6871770135734415,4.42484663185681,0.691153161953081,0.691153161953081,2.7508701982851385,4.019381523748645,0.691153161953081,5.117993812416755,4.42484663185681,4.607168188650764,4.42484663185681,3.914021008090819,4.42484663185681,3.914021008090819,2.7508701982851385,4.270695952029551,0.691153161953081,4.019381523748645,4.830311739964974])",0.0
F176,"[development, lay, particularly, price., community, traditional, decade., kitchen, long, author., —, shocking, claims, miracle, drug, surface, internet.]","(262144,[3665,34366,35623,38426,64181,76162,94822,119658,131016,135141,138667,188011,190212,191591,198400,205460,206312],[0.6871770135734415,4.42484663185681,0.691153161953081,0.691153161953081,4.830311739964974,0.691153161953081,4.607168188650764,5.523458920524919,3.125563647726549,5.523458920524919,4.137164559405029,4.270695952029551,4.270695952029551,4.830311739964974,0.691153161953081,2.849310271098391,4.607168188650764])",0.0
R245,"[soldier, section, oil, agent, cold, investment., consumer, financial, order, seem., spring, along, meet, reduce, daughter., experts, discuss, ongoing, developments, technology, breakthrough.]","(262144,[24016,38422,40872,56956,72462,73171,98586,108340,131519,153524,166319,166936,177466,179382,189996,192742,195459,196573,196975,199411,221128],[4.270695952029551,5.117993812416755,3.8187108282864943,2.579019941358479,0.6871770135734415,4.270695952029551,4.019381523748645,4.830311739964974,3.8187108282864943,3.914021008090819,4.019381523748645,4.270695952029551,0.691153161953081,5.523458920524919,4.270695952029551,0.6832166123573445,2.7200985396183848,4.42484663185681,0.691153161953081,4.830311739964974,4.270695952029551])",1.0
R104,"[involve, soon, popular., exactly, plant, hot, data, it., instead, artist, image, process, tonight, condition, prevent., experts, discuss, ongoing, developments, election.]","(262144,[41348,47197,52351,72462,73853,74375,84640,98730,125535,143057,143501,152963,160735,177466,192742,196975,202258,227040,248200,260940],[2.7508701982851385,4.137164559405029,4.019381523748645,0.6871770135734415,4.42484663185681,4.607168188650764,3.8187108282864943,5.523458920524919,4.607168188650764,4.019381523748645,5.523458920524919,3.8187108282864943,4.607168188650764,0.691153161953081,0.6832166123573445,0.691153161953081,5.117993812416755,4.607168188650764,3.7316994512968646,4.019381523748645])",1.0
F156,"[citizen, interesting, deal, reduce, case, region., remember, lawyer, nice, national., —, shocking, claims, flat, earth, surface, internet.]","(262144,[3665,22346,35623,37542,38426,50197,76162,85085,115996,165865,166319,186264,192310,196997,198400,234706,235778],[0.6871770135734415,3.7316994512968646,0.691153161953081,3.0385522707369192,0.691153161953081,4.607168188650764,0.691153161953081,3.6516567436233283,3.0385522707369192,4.137164559405029,4.019381523748645,4.270695952029551,4.42484663185681,4.42484663185681,0.691153161953081,4.137164559405029,5.117993812416755])",0.0
R194,"[part, analysis, learn, party, never, join., daughter, probably, federal, front., former, bag, share, feel, often., experts, discuss, ongoing, developments, election.]","(262144,[8804,41348,61899,62400,64859,72462,72973,78170,113673,132543,148921,150224,173511,177466,181087,184195,192229,192742,196975,211529],[4.270695952029551,2.7508701982851385,4.019381523748645,4.137164559405029,4.019381523748645,0.6871770135734415,4.830311739964974,5.117993812416755,4.019381523748645,4.270695952029551,3.914021008090819,4.42484663185681,4.270695952029551,0.691153161953081,3.914021008090819,3.914021008090819,4.830311739964974,0.6832166123573445,0.691153161953081,4.137164559405029])",1.0
R161,"[thousand, important, attorney, certain, nature., low, meeting, charge, scene, per., experts, discuss, ongoing, developments, technology, breakthrough.]","(262144,[15391,39668,56956,72165,72462,78820,143000,156804,161418,177466,192742,195459,196975,210238,235803,258188],[4.42484663185681,5.117993812416755,2.579019941358479,4.019381523748645,0.6871770135734415,4.607168188650764,4.830311739964974,4.019381523748645,4.830311739964974,0.691153161953081,0.6832166123573445,2.7200985396183848,0.691153161953081,3.8187108282864943,4.137164559405029,4.830311739964974])",1.0
F113,"[remember, carry, nearly, cold, front., scientist, enjoy, must, rise, space, ready, box., —, shocking, claims, immortal, jellyfish, surface, internet.]","(262144,[2701,3665,6034,24016,35590,35623,38426,45252,52306,54176,62242,72973,76162,166372,168886,196997,198400,219709,229407],[4.607168188650764,0.6871770135734415,4.019381523748645,4.270695952029551,5.523458920524919,0.691153161953081,0.691153161953081,3.914021008090819,2.7508701982851385,4.137164559405029,4.137164559405029,4.830311739964974,0.691153161953081,2.7508701982851385,4.42484663185681,4.42484663185681,0.691153161953081,3.914021008090819,3.8187108282864943])",0.0
F150,"[realize, process, election., thousand, open, fight, force, service., —, shocking, claims, hoax, surface, internet.]","(262144,[3665,4254,35623,38426,41348,56103,65069,76162,101641,146542,169527,198400,210238,248200],[0.6871770135734415,3.914021008090819,0.691153161953081,0.691153161953081,2.7508701982851385,4.270695952029551,5.117993812416755,0.691153161953081,2.60568818844064,4.830311739964974,4.019381523748645,0.691153161953081,3.8187108282864943,3.7316994512968646])",0.0
F047,"[one, country, able, rise, senior., east, church, push, lot, team., —, shocking, claims, miracle, drug, surface, internet.]","(262144,[3665,12336,21823,35623,38426,54176,76162,101464,118617,131016,155894,163886,198400,205460,235733,237210,245599],[0.6871770135734415,4.42484663185681,4.42484663185681,0.691153161953081,0.691153161953081,4.137164559405029,0.691153161953081,4.137164559405029,3.914021008090819,3.125563647726549,5.523458920524919,4.607168188650764,0.691153161953081,2.849310271098391,5.523458920524919,3.914021008090819,4.137164559405029])",0.0
F008,"[stay, together, address, foreign, company, subject, central., laugh, card, animal, argue, factor, fast., —, shocking, claims, hoax, surface, internet.]","(262144,[3665,5078,35623,36319,38426,73249,76162,89903,97914,101641,131519,147224,149982,161106,198400,203193,223600,232384,261070],[0.6871770135734415,4.607168188650764,0.691153161953081,4.270695952029551,0.691153161953081,4.270695952029551,0.691153161953081,4.830311739964974,3.8187108282864943,2.60568818844064,3.8187108282864943,4.019381523748645,4.42484663185681,4.137164559405029,0.691153161953081,4.270695952029551,4.137164559405029,4.019381523748645,4.607168188650764])",0.0
F229,"[week, fine, read, million, response., might, tv, even, operation, finish, republican., young, drive, take, avoid., —, shocking, claims, aliens, surface, internet.]","(262144,[3665,27139,35623,36225,38426,53570,55307,55639,65164,69650,76162,146821,174966,178266,181799,196946,198400,208190,220194,245951,256468],[0.6871770135734415,5.117993812416755,0.691153161953081,4.42484663185681,0.691153161953081,4.019381523748645,4.019381523748645,4.270695952029551,5.117993812416755,3.914021008090819,0.691153161953081,3.914021008090819,4.270695952029551,2.958509563063383,4.830311739964974,4.42484663185681,0.691153161953081,4.607168188650764,4.019381523748645,4.137164559405029,4.019381523748645])",0.0
R001,"[huge, partner, artist, exist, large., compare, nation, stuff, story, sit, lead., lawyer, arrive, actually, clearly, old, tough, friend., experts, discuss, ongoing, developments, research.]","(262144,[18270,43204,45190,56194,72462,81210,85085,93722,111767,132975,152963,173564,177466,182235,192202,192742,196975,205687,216975,236097,255006,257866,258526],[4.607168188650764,4.42484663185681,4.42484663185681,3.914021008090819,0.6871770135734415,3.8187108282864943,3.6516567436233283,2.8844015909096608,4.42484663185681,3.914021008090819,3.8187108282864943,4.830311739964974,0.691153161953081,4.270695952029551,4.607168188650764,0.6832166123573445,0.691153161953081,4.137164559405029,4.137164559405029,5.117993812416755,4.830311739964974,4.019381523748645,4.019381523748645])",1.0
R241,"[physical, answer, show, politics., according, provide, fill, agent, suggest., church, safe, especially, wish, open., wall, common, sound, expert, nothing, difference, street., experts, discuss, ongoing, developments, public, health.]","(262144,[3834,11018,20719,30539,32435,33180,38308,40774,40872,72462,73199,82035,116996,118617,139109,174506,177466,189734,192742,196975,200652,203609,224909,245731,246556,247026,260874],[4.137164559405029,4.42484663185681,3.914021008090819,3.125563647726549,5.523458920524919,4.607168188650764,3.7316994512968646,5.117993812416755,3.8187108282864943,0.6871770135734415,3.914021008090819,4.137164559405029,4.830311739964974,3.914021008090819,5.117993812416755,3.0385522707369192,0.691153161953081,4.270695952029551,0.6832166123573445,0.691153161953081,5.523458920524919,4.607168188650764,4.137164559405029,4.270695952029551,4.607168188650764,3.6516567436233283,4.137164559405029])",1.0
R198,"[air, sister, analysis, return, assume, subject, cup, yard., environmental, increase, technology, discuss, within., experts, discuss, ongoing, developments, climate, change.]","(262144,[19371,36319,47819,56956,72462,73499,75249,98424,129123,150224,154659,168503,177466,181736,185509,192742,196975,261675],[4.137164559405029,4.270695952029551,3.914021008090819,2.579019941358479,1.374354027146883,2.7508701982851385,4.607168188650764,4.607168188650764,5.523458920524919,4.42484663185681,4.270695952029551,5.117993812416755,0.691153161953081,3.914021008090819,2.849310271098391,0.6832166123573445,0.691153161953081,4.137164559405029])",1.0
R229,"[prove, unit, sign., thus, might, become, project, really, on., experts, discuss, ongoing, developments, research.]","(262144,[4390,21570,43583,50886,72462,93722,177466,192742,196975,216308,228651,229264,250430,256468],[5.523458920524919,4.42484663185681,3.577548771469606,4.019381523748645,0.6871770135734415,2.8844015909096608,0.691153161953081,0.6832166123573445,0.691153161953081,4.019381523748645,5.117993812416755,4.42484663185681,4.019381523748645,4.019381523748645])",1.0
R205,"[true, center, article, lawyer, morning, guy, smile, section., recently, always, assume., experts, discuss, ongoing, developments, public, health.]","(262144,[30539,61734,72462,79779,85085,131672,157865,161102,162104,174506,177466,187558,192742,196975,204877,231746,254292],[3.125563647726549,4.019381523748645,0.6871770135734415,3.8187108282864943,3.6516567436233283,4.137164559405029,4.019381523748645,4.019381523748645,4.607168188650764,3.0385522707369192,0.691153161953081,5.117993812416755,0.6832166123573445,0.691153161953081,4.270695952029551,4.137164559405029,4.607168188650764])",1.0
F123,"[save, democratic, finish, shoulder., wrong, court, teacher, growth, quite, rock., —, shocking, claims, celebrity, scandal, surface, internet.]","(262144,[3665,3968,25838,31064,35623,38426,53140,69650,70152,76162,88124,153174,181561,198400,199496,201440,225216],[0.6871770135734415,5.117993812416755,2.849310271098391,4.019381523748645,0.691153161953081,0.691153161953081,4.607168188650764,3.914021008090819,4.137164559405029,0.691153161953081,4.830311739964974,4.270695952029551,2.849310271098391,0.691153161953081,4.607168188650764,4.019381523748645,5.117993812416755])",0.0
F043,"[arm, manage, unit, will., forget, population, cause, value., —, shocking, claims, celebrity, scandal, surface, internet.]","(262144,[1968,3665,25838,35623,38426,42299,43583,59514,73018,75018,76162,77772,181561,198400,255360],[4.137164559405029,0.6871770135734415,2.849310271098391,0.691153161953081,0.691153161953081,4.019381523748645,3.577548771469606,3.914021008090819,4.270695952029551,5.117993812416755,0.691153161953081,3.914021008090819,2.849310271098391,0.691153161953081,4.607168188650764])",0.0
